title,link,date,source,country,language,translated_title,number_of_characters_title,number_of_words_title,day_of_week,month,year,quarter,is_weekend,is_holiday,source_type,final_redirected_URL,domain_of_URL,subdomain_of_URL,URL_depth,top_level_domain,url_length,author,polarity1,subjectivity,compound,vader_sentiment,summary
Cathie Wood Says Software Is the Next Big AI Buying Opportunity. 2 ... - The Motley Fool,https://news.google.com/rss/articles/CBMiXWh0dHBzOi8vd3d3LmZvb2wuY29tL2ludmVzdGluZy8yMDIzLzEwLzAyL2NhdGhpZS13b29kLXNheXMtc29mdHdhcmUtYWktYnV5aW5nLTItc3RvY2tzLWJvdWdoL9IBAA?oc=5,2023-10-02,The Motley Fool,US,en,cathie wood says software is the next big ai buying opportunity    the motley fool,72,17,Monday,10,2023,4,False,False,Blog,https://www.fool.com/investing/2023/10/02/cathie-wood-says-software-ai-buying-2-stocks-bough/,www.fool.com,www,6,com,93,['Anthony Di Pizio'],0.1999999999999999,0.3333333333333333,-0.0258,negative,The potential of artificial intelligence (AI
Chief technology officers are concerned about Generative AI’s ‘shiny object’ problem - Fortune,https://news.google.com/rss/articles/CBMiZWh0dHBzOi8vZm9ydHVuZS5jb20vMjAyMy8xMC8wMy9oYWxsdWNpbmF0aW9ucy1zaGlueS1vYmplY3RzLWN0b3MtY29uY2VybmVkLXJpc2tzLWNvc3RzLWdlbmVyYXRpdmUtYWkv0gFpaHR0cHM6Ly9mb3J0dW5lLmNvbS8yMDIzLzEwLzAzL2hhbGx1Y2luYXRpb25zLXNoaW55LW9iamVjdHMtY3Rvcy1jb25jZXJuZWQtcmlza3MtY29zdHMtZ2VuZXJhdGl2ZS1haS9hbXAv?oc=5,2023-10-02,Fortune,US,en,chief technology officers are concerned about generative ais shiny object problem  fortune,82,13,Monday,10,2023,4,False,False,News Outlet,https://fortune.com/2023/10/03/hallucinations-shiny-objects-ctos-concerned-risks-costs-generative-ai/,fortune.com,fortune,5,com,101,[],0.0,0.0,-0.4019,negative,The Fortune CEO Initiative’s
AI Vincent van Gogh talks of ‘mental health struggles’ in Paris exhibition - The Guardian,https://news.google.com/rss/articles/CBMifWh0dHBzOi8vd3d3LnRoZWd1YXJkaWFuLmNvbS9hcnRhbmRkZXNpZ24vMjAyMy9vY3QvMDIvYWktdmluY2VudC12YW4tZ29naC10YWxrcy1vZi1tZW50YWwtaGVhbHRoLXN0cnVnZ2xlcy1pbi1wYXJpcy1leGhpYml0aW9u0gF9aHR0cHM6Ly9hbXAudGhlZ3VhcmRpYW4uY29tL2FydGFuZGRlc2lnbi8yMDIzL29jdC8wMi9haS12aW5jZW50LXZhbi1nb2doLXRhbGtzLW9mLW1lbnRhbC1oZWFsdGgtc3RydWdnbGVzLWluLXBhcmlzLWV4aGliaXRpb24?oc=5,2023-10-02,The Guardian,US,en,ai vincent van gogh talks of mental health struggles in paris exhibition  the guardian,75,15,Monday,10,2023,4,False,False,News Outlet,https://www.theguardian.com/artanddesign/2023/oct/02/ai-vincent-van-gogh-talks-of-mental-health-struggles-in-paris-exhibition,www.theguardian.com,www,5,com,125,['Kim Willsher'],-0.1,0.2,-0.3612,negative,Musée d’Ors
Flows into AI funds wane as US rate worries weigh - Reuters,https://news.google.com/rss/articles/CBMiXWh0dHBzOi8vd3d3LnJldXRlcnMuY29tL3RlY2hub2xvZ3kvZmxvd3MtaW50by1haS1mdW5kcy13YW5lLXVzLXJhdGUtd29ycmllcy13ZWlnaC0yMDIzLTEwLTAyL9IBAA?oc=5,2023-10-02,Reuters,US,en,flows into ai funds wane as us rate worries weigh  reuters,48,12,Monday,10,2023,4,False,False,News Outlet,https://www.reuters.com/technology/flows-into-ai-funds-wane-us-rate-worries-weigh-2023-10-02/,www.reuters.com,www,3,com,93,[],0.0,0.0,-0.4215,negative,0
Artificial Intelligence (A.I.) has changed online scams sponsored by Techish.com - WCNC.com,https://news.google.com/rss/articles/CBMitwFodHRwczovL3d3dy53Y25jLmNvbS9hcnRpY2xlL2VudGVydGFpbm1lbnQvdGVsZXZpc2lvbi9jaGFybG90dGUtdG9kYXkvYXJ0aWZpY2lhbC1pbnRlbGxpZ2VuY2UtaGFzLWNoYW5nZWQtb25saW5lLXNjYW1zLXNwb25zb3JlZC1ieS10ZWNoaXNoY29tLzI3NS1iNDI3Y2M3Yy1hMzQ4LTQ1ZGItOGFkYy1hMTc5ZmE4ZDg5MzTSAbsBaHR0cHM6Ly93d3cud2NuYy5jb20vYW1wL2FydGljbGUvZW50ZXJ0YWlubWVudC90ZWxldmlzaW9uL2NoYXJsb3R0ZS10b2RheS9hcnRpZmljaWFsLWludGVsbGlnZW5jZS1oYXMtY2hhbmdlZC1vbmxpbmUtc2NhbXMtc3BvbnNvcmVkLWJ5LXRlY2hpc2hjb20vMjc1LWI0MjdjYzdjLWEzNDgtNDVkYi04YWRjLWExNzlmYThkODkzNA?oc=5,2023-10-02,WCNC.com,US,en,artificial intelligence ai has changed online scams sponsored by techishcom  wcnccom,80,12,Monday,10,2023,4,False,False,Other,https://www.wcnc.com/article/entertainment/television/charlotte-today/artificial-intelligence-has-changed-online-scams-sponsored-by-techishcom/275-b427cc7c-a348-45db-8adc-a179fa8d8934,www.wcnc.com,www,6,com,183,[],-0.6,1.0,-0.1779,negative,Artificial Intelligence (AI) is
"How to talk to kids about AI risks, uses | Expert Opinion - The Philadelphia Inquirer",https://news.google.com/rss/articles/CBMiTGh0dHBzOi8vd3d3LmlucXVpcmVyLmNvbS9oZWFsdGgvYWktY2hpbGRyZW4tcGFyZW50cy1kaXNjdXNzaW9uLTIwMjMxMDAyLmh0bWzSAQA?oc=5,2023-10-02,The Philadelphia Inquirer,US,en,how to talk to kids about ai risks uses  expert opinion  the philadelphia inquirer,70,16,Monday,10,2023,4,False,False,News Outlet,https://www.inquirer.com/health/ai-children-parents-discussion-20231002.html,www.inquirer.com,www,2,com,76,"['Jessica Kendorski', 'Share On', 'Share Via', 'Richard Drew']",0.0,0.0,-0.2732,negative,Jessica Kendorski is chair of
Unlocking the Power of AI: Amazon’s Multibillion-Dollar Investment ... - USA Herald,https://news.google.com/rss/articles/CBMiZGh0dHBzOi8vdXNhaGVyYWxkLmNvbS91bmxvY2tpbmctdGhlLXBvd2VyLW9mLWFpLWFtYXpvbnMtbXVsdGliaWxsaW9uLWRvbGxhci1pbnZlc3RtZW50LWluLWFudGhyb3BpYy_SAQA?oc=5,2023-10-02,USA Herald,US,en,unlocking the power of ai amazons multibilliondollar investment   usa herald,72,12,Monday,10,2023,4,False,False,News Outlet,https://usaherald.com/unlocking-the-power-of-ai-amazons-multibillion-dollar-investment-in-anthropic/,usaherald.com,usaherald,2,com,100,"['Jackie Allen', 'Jackie Is A Freelance Journalist', 'Technology Geek. She Worked As A Telecom Project Director For At T', 'Bellsouth. Before Joining The Usa Herald She Has Written Books', 'Articles', 'Blogs', 'Whitepapers. Her Clients Include Samsung', 'Other Technology Companies.']",0.0,0.0,-0.0258,negative,Amazon is making a strategic move to
"Tom Hanks, Robin Williams' daughter slam recent AI recreations ... - Salon",https://news.google.com/rss/articles/CBMiPWh0dHBzOi8vd3d3LnNhbG9uLmNvbS8yMDIzLzEwLzAyL2FpLXRvbS1oYW5rcy1yb2Jpbi13aWxsaWFtcy_SAQA?oc=5,2023-10-02,Salon,US,en,tom hanks robin williams daughter slam recent ai recreations   salon,63,12,Monday,10,2023,4,False,False,Other,https://www.salon.com/2023/10/02/ai-tom-hanks-robin-williams/,www.salon.com,www,5,com,61,[],0.0,0.25,-0.3818,negative,Tom Hanks took to Instagram to
How overregulating AI could make the technology more dangerous - San Francisco Chronicle,https://news.google.com/rss/articles/CBMiXWh0dHBzOi8vd3d3LnNmY2hyb25pY2xlLmNvbS9vcGluaW9uL29wZW5mb3J1bS9hcnRpY2xlL2FpLXJlZ3VsYXRpb24tYWx0ZXJuYXRpdmVzLTE4MzkwNDA5LnBocNIBAA?oc=5,2023-10-02,San Francisco Chronicle,US,en,how overregulating ai could make the technology more dangerous  san francisco chronicle,76,13,Monday,10,2023,4,False,False,News Outlet,https://www.sfchronicle.com/opinion/openforum/article/ai-regulation-alternatives-18390409.php,www.sfchronicle.com,www,4,com,93,[],-0.0499999999999999,0.7,-0.5256,negative,0
US-China 'tech war': AI sparks first battle in Middle East - DW (English),https://news.google.com/rss/articles/CBMiWGh0dHBzOi8vd3d3LmR3LmNvbS9lbi91cy1jaGluYS10ZWNoLXdhci1haS1zcGFya3MtZmlyc3QtYmF0dGxlLWluLW1pZGRsZS1lYXN0L2EtNjY5Njg4ODbSAVhodHRwczovL2FtcC5kdy5jb20vZW4vdXMtY2hpbmEtdGVjaC13YXItYWktc3BhcmtzLWZpcnN0LWJhdHRsZS1pbi1taWRkbGUtZWFzdC9hLTY2OTY4ODg2?oc=5,2023-10-02,DW (English),US,en,uschina tech war ai sparks first battle in middle east  dw english,61,13,Monday,10,2023,4,False,False,Other,https://www.dw.com/en/us-china-tech-war-ai-sparks-first-battle-in-middle-east/a-66968886,www.dw.com,www,3,com,88,[],0.0833333333333333,0.1111111111111111,-0.7579,negative,US has restricted exports of some computer
"5 things about AI you may have missed today: Freedom House on AI, Vincent van Gogh AI, fake AI ad, and more - HT Tech",https://news.google.com/rss/articles/CBMipQFodHRwczovL3RlY2guaGluZHVzdGFudGltZXMuY29tL3RlY2gvbmV3cy81LXRoaW5ncy1hYm91dC1haS15b3UtbWF5LWhhdmUtbWlzc2VkLXRvZGF5LWZyZWVkb20taG91c2Utb24tYWktdmluY2VudC12YW4tZ29naC1haS1mYWtlLWFpLWFkLWFuZC1tb3JlLTcxNjk2MjU2NTc4MjA3Lmh0bWzSAakBaHR0cHM6Ly90ZWNoLmhpbmR1c3RhbnRpbWVzLmNvbS9hbXAvdGVjaC9uZXdzLzUtdGhpbmdzLWFib3V0LWFpLXlvdS1tYXktaGF2ZS1taXNzZWQtdG9kYXktZnJlZWRvbS1ob3VzZS1vbi1haS12aW5jZW50LXZhbi1nb2doLWFpLWZha2UtYWktYWQtYW5kLW1vcmUtNzE2OTYyNTY1NzgyMDcuaHRtbA?oc=5,2023-10-02,HT Tech,US,en, things about ai you may have missed today freedom house on ai vincent van gogh ai fake ai ad and more  ht tech,93,25,Monday,10,2023,4,False,False,Blog,https://tech.hindustantimes.com/tech/news/5-things-about-ai-you-may-have-missed-today-freedom-house-on-ai-vincent-van-gogh-ai-fake-ai-ad-and-more-71696256578207.html,tech.hindustantimes.com,tech,3,com,165,[],0.0,0.75,-0.0258,negative,Freedom on the Net report flags risks
Tom Hanks Becomes Celebrity AI Impersonation Victim in Dental ... - TheWrap,https://news.google.com/rss/articles/CBMiYWh0dHBzOi8vd3d3LnRoZXdyYXAuY29tL3RvbS1oYW5rcy1jZWxlYnJpdHktYWktYXJ0aWZpY2lhbC1pbnRlbGxpZ2VuY2UtaW1wZXJzb25hdGlvbi1kZW50YWwtcGxhbi_SAQA?oc=5,2023-10-01,TheWrap,US,en,tom hanks becomes celebrity ai impersonation victim in dental   thewrap,64,12,Sunday,10,2023,4,True,False,Other,https://www.thewrap.com/tom-hanks-celebrity-ai-artificial-intelligence-impersonation-dental-plan/,www.thewrap.com,www,2,com,97,"['Mike Roe', 'Jeremy Fuster', 'Haleigh Foutch', 'Steve Pond', 'Mike Roe Joined The Staff As Weekend News Editor For Thewrap In Before That', 'He Wrote', 'The Rock Book', 'For Publisher Abrams', 'Won An L.A. Press Club Award For His Oral History Of', 'Rock S']",-0.075,0.05,-0.2732,negative,Tom Hanks warned followers about a
"Writers Strike Is Over, But the AI Jobs Debate Is Just Beginning - Bloomberg",https://news.google.com/rss/articles/CBMidWh0dHBzOi8vd3d3LmJsb29tYmVyZy5jb20vb3Bpbmlvbi9hcnRpY2xlcy8yMDIzLTEwLTAxL3dyaXRlcnMtc3RyaWtlLWlzLW92ZXItYnV0LXRoZS1haS1qb2JzLWRlYmF0ZS1pcy1qdXN0LWJlZ2lubmluZ9IBAA?oc=5,2023-10-01,Bloomberg,US,en,writers strike is over but the ai jobs debate is just beginning  bloomberg,63,14,Sunday,10,2023,4,True,False,News Outlet,https://www.bloomberg.com/tosv2.html?vid=&uuid=9da0cb38-9765-11ee-aeb2-b940ec14971f&url=L29waW5pb24vYXJ0aWNsZXMvMjAyMy0xMC0wMS93cml0ZXJzLXN0cmlrZS1pcy1vdmVyLWJ1dC10aGUtYWktam9icy1kZWJhdGUtaXMtanVzdC1iZWdpbm5pbmc=,www.bloomberg.com,www,1,com,212,[],0.0,0.0,-0.0644,negative,"summarize: To continue,"
AI girlfriends are here and they're posing a threat to a generation of ... - msnNOW,https://news.google.com/rss/articles/CBMifGh0dHBzOi8vd3d3Lm1zbi5jb20vZW4tdXMvbW9uZXkvb3RoZXIvYWktZ2lybGZyaWVuZHMtYXJlLWhlcmUtYW5kLXRoZXktcmUtcG9zaW5nLWEtdGhyZWF0LXRvLWEtZ2VuZXJhdGlvbi1vZi1tZW4vdmktQUExaHdNRFDSAQA?oc=5,2023-10-01,msnNOW,US,en,ai girlfriends are here and theyre posing a threat to a generation of   msnnow,68,16,Sunday,10,2023,4,True,False,News Outlet,https://www.msn.com/,www.msn.com,www,1,com,20,[],0.0,0.0,-0.5267,negative,summarize: 
A lot of dumb money is chasing artificial intelligence. This is how I ... - The Telegraph,https://news.google.com/rss/articles/CBMib2h0dHBzOi8vd3d3LnRlbGVncmFwaC5jby51ay9tb25leS9pbnZlc3Rpbmcvc3RvY2tzLXNoYXJlcy9hcnRpZmljaWFsLWludGVsbGlnZW5jZS1zaG91bGQteW91LWludmVzdC1kdW1iLW1vbmV5L9IBAA?oc=5,2023-10-01,The Telegraph,US,en,a lot of dumb money is chasing artificial intelligence this is how i   the telegraph,73,17,Sunday,10,2023,4,True,False,News Outlet,https://www.telegraph.co.uk/money/investing/stocks-shares/artificial-intelligence-should-you-invest-dumb-money/,www.telegraph.co.uk,www,5,uk,111,"['Ken', 'October']",-0.4875,0.75,-0.0516,negative,Artificial intelligence carries opportunities and risks
10 AI Cybersecurity Threats You Should Be Aware Of - Analytics Insight,https://news.google.com/rss/articles/CBMiVGh0dHBzOi8vd3d3LmFuYWx5dGljc2luc2lnaHQubmV0LzEwLWFpLWN5YmVyc2VjdXJpdHktdGhyZWF0cy15b3Utc2hvdWxkLWJlLWF3YXJlLW9mL9IBAA?oc=5,2023-10-01,Analytics Insight,US,en, ai cybersecurity threats you should be aware of  analytics insight,59,12,Sunday,10,2023,4,True,False,Blog,https://www.analyticsinsight.net/10-ai-cybersecurity-threats-you-should-be-aware-of/,www.analyticsinsight.net,www,2,net,84,[],0.25,0.25,-0.4215,negative,The growth of artificial intelligence has increased
Canada's voluntary AI code of conduct is coming — not everyone is enthused - CBC News,https://news.google.com/rss/articles/CBMiRWh0dHBzOi8vd3d3LmNiYy5jYS9uZXdzL2J1c2luZXNzL2FpLWNvZGUtb2YtY29uZHVjdC1zdG9wZ2FwLTEuNjk4MzA2NNIBIGh0dHBzOi8vd3d3LmNiYy5jYS9hbXAvMS42OTgzMDY0?oc=5,2023-10-01,CBC News,US,en,canadas voluntary ai code of conduct is coming  not everyone is enthused  cbc news,70,16,Sunday,10,2023,4,True,False,News Outlet,https://www.cbc.ca/news/business/ai-code-of-conduct-stopgap-1.6983064,www.cbc.ca,www,3,ca,69,"['Senior Reporter', 'Anis Heydari Is A Senior Business Reporter At Cbc News. Prior To That', ""He Was On The Founding Team Of Cbc Radio'S"", 'The Cost Of Living', ""Has Also Reported For Npr'S"", 'The Indicator Planet Money.', ""He'S Lived"", 'Worked In Edmonton', 'Edinburgh', 'Southwestern Ontario']",0.0,0.0,-0.357,negative,Canada is offering a voluntary code of
AI assistants boost productivity but paradoxically risk human deskilling - VentureBeat,https://news.google.com/rss/articles/CBMiZGh0dHBzOi8vdmVudHVyZWJlYXQuY29tL2FpL2FpLWFzc2lzdGFudHMtYm9vc3QtcHJvZHVjdGl2aXR5LWJ1dC1wYXJhZG94aWNhbGx5LXJpc2staHVtYW4tZGVza2lsbGluZy_SAQA?oc=5,2023-10-01,VentureBeat,US,en,ai assistants boost productivity but paradoxically risk human deskilling  venturebeat,76,11,Sunday,10,2023,4,True,False,Other,https://venturebeat.com/ai/ai-assistants-boost-productivity-but-paradoxically-risk-human-deskilling/,venturebeat.com,venturebeat,3,com,100,['Gary Grossman'],0.0,0.1,-0.2023,negative,0
Here Are the Top AI Stories You Missed This Week - Gizmodo,https://news.google.com/rss/articles/CBMiT2h0dHBzOi8vZ2l6bW9kby5jb20vaGVyZS1hcmUtdGhlLXRvcC1haS1zdG9yaWVzLXlvdS1taXNzZWQtdGhpcy13ZWVrLTE4NTA4ODgyOTfSAQA?oc=5,2023-10-01,Gizmodo,US,en,here are the top ai stories you missed this week  gizmodo,47,12,Sunday,10,2023,4,True,False,Other,https://gizmodo.com/here-are-the-top-ai-stories-you-missed-this-week-1850888297,gizmodo.com,gizmodo,1,com,79,[],0.5,0.5,-0.1027,negative,OpenAI launched a bunch of new
How to setup and use the new Microsoft AutoGen AI agent - Geeky Gadgets,https://news.google.com/rss/articles/CBMiMGh0dHBzOi8vd3d3LmdlZWt5LWdhZGdldHMuY29tL21pY3Jvc29mdC1hdXRvZ2VuL9IBAA?oc=5,2023-10-01,Geeky Gadgets,US,en,how to setup and use the new microsoft autogen ai agent  geeky gadgets,58,14,Sunday,10,2023,4,True,False,Other,https://www.geeky-gadgets.com/microsoft-autogen/,www.geeky-gadgets.com,www,2,com,48,['Julian Horsey'],0.1363636363636363,0.4545454545454545,-0.1531,negative,0
Key Tips and Tricks to Leverage AI in Data Analysis - Analytics Insight,https://news.google.com/rss/articles/CBMiVWh0dHBzOi8vd3d3LmFuYWx5dGljc2luc2lnaHQubmV0L2tleS10aXBzLWFuZC10cmlja3MtdG8tbGV2ZXJhZ2UtYWktaW4tZGF0YS1hbmFseXNpcy_SAQA?oc=5,2023-10-01,Analytics Insight,US,en,key tips and tricks to leverage ai in data analysis  analytics insight,59,13,Sunday,10,2023,4,True,False,Blog,https://www.analyticsinsight.net/key-tips-and-tricks-to-leverage-ai-in-data-analysis/,www.analyticsinsight.net,www,2,net,85,[],0.0,1.0,-0.128,negative,In today’s data-
Dead Bird Drones May Get Artificial Intelligence and 5G - Signal Magazine,https://news.google.com/rss/articles/CBMiZWh0dHBzOi8vd3d3LmFmY2VhLm9yZy9zaWduYWwtbWVkaWEvdGVjaG5vbG9neS9kZWFkLWJpcmQtZHJvbmVzLW1heS1nZXQtYXJ0aWZpY2lhbC1pbnRlbGxpZ2VuY2UtYW5kLTVn0gEA?oc=5,2023-10-01,Signal Magazine,US,en,dead bird drones may get artificial intelligence and g  signal magazine,62,12,Sunday,10,2023,4,True,False,Magazine,https://www.afcea.org/signal-media/technology/dead-bird-drones-may-get-artificial-intelligence-and-5g,www.afcea.org,www,3,org,101,['George I. Seffers'],-0.4,0.7,-0.296,negative,Researchers at the New Mexico Institute of
The Skeptics Who Believe AI Is a Bubble — Could They Be Right? - Techopedia,https://news.google.com/rss/articles/CBMiVmh0dHBzOi8vd3d3LnRlY2hvcGVkaWEuY29tL3RoZS1za2VwdGljcy13aG8tYmVsaWV2ZS1haS1pcy1hLWJ1YmJsZS1jb3VsZC10aGV5LWJlLXJpZ2h00gEA?oc=5,2023-10-01,Techopedia,US,en,the skeptics who believe ai is a bubble  could they be right  techopedia,61,15,Sunday,10,2023,4,True,False,Blog,https://www.techopedia.com/the-skeptics-who-believe-ai-is-a-bubble-could-they-be-right,www.techopedia.com,www,1,com,86,[],0.2857142857142857,0.5357142857142857,-0.1027,negative,0
ChatGPT’s New Upgrade Teases AI’s Multimodal Future - IEEE Spectrum,https://news.google.com/rss/articles/CBMiLGh0dHBzOi8vc3BlY3RydW0uaWVlZS5vcmcvY2hhdGdwdC1tdWx0aW1vZGFs0gE7aHR0cHM6Ly9zcGVjdHJ1bS5pZWVlLm9yZy9hbXAvY2hhdGdwdC1tdWx0aW1vZGFsLTI2NjU3MzkzMTM?oc=5,2023-10-01,IEEE Spectrum,US,en,chatgpts new upgrade teases ais multimodal future  ieee spectrum,58,10,Sunday,10,2023,4,True,False,Academic Journal,https://spectrum.ieee.org/chatgpt-multimodal,spectrum.ieee.org,spectrum,1,org,44,['Matthew S. Smith'],0.0681818181818181,0.2897727272727273,-0.296,negative,OpenAI’s latest upgrade
EU examines Nvidia-dominated AI chip market’s alleged abuses - The Indian Express,https://news.google.com/rss/articles/CBMiiQFodHRwczovL2luZGlhbmV4cHJlc3MuY29tL2FydGljbGUvdGVjaG5vbG9neS9hcnRpZmljaWFsLWludGVsbGlnZW5jZS9ldS1leGFtaW5lcy1udmlkaWEtZG9taW5hdGVkLWFpLWNoaXAtbWFya2V0cy1hbGxlZ2VkLWFidXNlcy04OTYzNTEyL9IBjgFodHRwczovL2luZGlhbmV4cHJlc3MuY29tL2FydGljbGUvdGVjaG5vbG9neS9hcnRpZmljaWFsLWludGVsbGlnZW5jZS9ldS1leGFtaW5lcy1udmlkaWEtZG9taW5hdGVkLWFpLWNoaXAtbWFya2V0cy1hbGxlZ2VkLWFidXNlcy04OTYzNTEyL2xpdGUv?oc=5,2023-10-01,The Indian Express,US,en,eu examines nvidiadominated ai chip markets alleged abuses  the indian express,70,12,Sunday,10,2023,4,True,False,Press Release Service,"('', '', 0, '', 0, '')",,,0,,0,[],-0.1,0.1,-0.5574,negative,The European Union is examining alleged antic
"AI 'polluting the pool of human knowledge', news publishers warn - The Telegraph",https://news.google.com/rss/articles/CBMiZWh0dHBzOi8vd3d3LnRlbGVncmFwaC5jby51ay9idXNpbmVzcy8yMDIzLzEwLzAxL25ld3MtcHVibGlzaGVycy13YXJuLWFpLXdpbGwtcG9sbHV0ZS1odW1hbi1rbm93bGVkZ2Uv0gEA?oc=5,2023-10-01,The Telegraph,US,en,ai polluting the pool of human knowledge news publishers warn  the telegraph,68,13,Sunday,10,2023,4,True,False,News Outlet,https://www.telegraph.co.uk/business/2023/10/01/news-publishers-warn-ai-will-pollute-human-knowledge/,www.telegraph.co.uk,www,6,uk,101,['James Warrington'],0.0,0.1,-0.1027,negative,News outlets report 'troubling
Robin Williams’ Daughter Zelda Criticizes Use of AI to Re-create His Voice: “I Find It Personally Disturbing” - Hollywood Reporter,https://news.google.com/rss/articles/CBMidGh0dHBzOi8vd3d3LmhvbGx5d29vZHJlcG9ydGVyLmNvbS9idXNpbmVzcy9kaWdpdGFsL3JvYmluLXdpbGxpYW1zLXplbGRhLWNyaXRpY2l6ZXMtYWktcmVjcmVhdGUtaGlzLXZvaWNlLTEyMzU2MDU4MDUv0gF4aHR0cHM6Ly93d3cuaG9sbHl3b29kcmVwb3J0ZXIuY29tL2J1c2luZXNzL2RpZ2l0YWwvcm9iaW4td2lsbGlhbXMtemVsZGEtY3JpdGljaXplcy1haS1yZWNyZWF0ZS1oaXMtdm9pY2UtMTIzNTYwNTgwNS9hbXAv?oc=5,2023-10-01,Hollywood Reporter,US,en,robin williams daughter zelda criticizes use of ai to recreate his voice i find it personally disturbing  hollywood reporter,111,20,Sunday,10,2023,4,True,False,Other,https://www.hollywoodreporter.com/business/digital/robin-williams-zelda-criticizes-ai-recreate-his-voice-1235605805/,www.hollywoodreporter.com,www,4,com,116,['Kimberly Nordyke'],-0.5,0.8,-0.6908,negative,Robin Williams' daughter Zelda is speaking
Tom Hanks Warns Fans of AI Dental Plan Ad - TODAY,https://news.google.com/rss/articles/CBMiQGh0dHBzOi8vd3d3LnRvZGF5LmNvbS9wb3BjdWx0dXJlL25ld3MvdG9tLWhhbmtzLWFpLWFkLXJjbmExMTgzMDfSASpodHRwczovL3d3dy50b2RheS5jb20vdG9kYXkvYW1wL3JjbmExMTgzMDc?oc=5,2023-10-01,TODAY,US,en,tom hanks warns fans of ai dental plan ad  today,39,11,Sunday,10,2023,4,True,False,News Outlet,https://www.today.com/popculture/news/tom-hanks-ai-ad-rcna118307,www.today.com,www,3,com,64,"['Ariana Brockington', 'Ariana Brockington Is A Trending News Reporter At Today Digital. She Is Based In Los Angeles.']",0.0,0.0,-0.1027,negative,The Oscar-winner posted a screenshot
The Indecisive Moment: Street Photography and AI - PetaPixel,https://news.google.com/rss/articles/CBMiUWh0dHBzOi8vcGV0YXBpeGVsLmNvbS8yMDIzLzEwLzAxL3RoZS1pbmRlY2lzaXZlLW1vbWVudC1zdHJlZXQtcGhvdG9ncmFwaHktYW5kLWFpL9IBAA?oc=5,2023-10-01,PetaPixel,US,en,the indecisive moment street photography and ai  petapixel,52,9,Sunday,10,2023,4,True,False,Other,https://petapixel.com/2023/10/01/the-indecisive-moment-street-photography-and-ai/,petapixel.com,petapixel,5,com,81,['Guest Author'],0.0,0.0,-0.25,negative,0
"Blumenthal, Hawley AI framework could damage AI industry, violate First Amendment - The Hill",https://news.google.com/rss/articles/CBMiggFodHRwczovL3RoZWhpbGwuY29tL29waW5pb24vY29uZ3Jlc3MtYmxvZy80MjMyNjk3LWJsdW1lbnRoYWwtaGF3bGV5LWFpLWZyYW1ld29yay1jb3VsZC1kYW1hZ2UtYWktaW5kdXN0cnktdmlvbGF0ZS1maXJzdC1hbWVuZG1lbnQv0gGGAWh0dHBzOi8vdGhlaGlsbC5jb20vb3Bpbmlvbi9jb25ncmVzcy1ibG9nLzQyMzI2OTctYmx1bWVudGhhbC1oYXdsZXktYWktZnJhbWV3b3JrLWNvdWxkLWRhbWFnZS1haS1pbmR1c3RyeS12aW9sYXRlLWZpcnN0LWFtZW5kbWVudC9hbXAv?oc=5,2023-10-01,The Hill,US,en,blumenthal hawley ai framework could damage ai industry violate first amendment  the hill,79,14,Sunday,10,2023,4,True,False,News Outlet,https://thehill.com/opinion/congress-blog/4232697-blumenthal-hawley-ai-framework-could-damage-ai-industry-violate-first-amendment/,thehill.com,thehill,4,com,130,[],0.25,0.3333333333333333,-0.7506,negative,0
"Workers fear AI taking their jobs, but artists say it's already happening - Business Insider",https://news.google.com/rss/articles/CBMiWmh0dHBzOi8vd3d3LmJ1c2luZXNzaW5zaWRlci5jb20vYWktdGFraW5nLWpvYnMtZmVhcnMtYXJ0aXN0cy1zYXktYWxyZWFkeS1oYXBwZW5pbmctMjAyMy0xMNIBXmh0dHBzOi8vd3d3LmJ1c2luZXNzaW5zaWRlci5jb20vYWktdGFraW5nLWpvYnMtZmVhcnMtYXJ0aXN0cy1zYXktYWxyZWFkeS1oYXBwZW5pbmctMjAyMy0xMD9hbXA?oc=5,2023-10-01,Business Insider,US,en,workers fear ai taking their jobs but artists say its already happening  business insider,78,15,Sunday,10,2023,4,True,False,News Outlet,https://www.businessinsider.com/ai-taking-jobs-fears-artists-say-already-happening-2023-10,www.businessinsider.com,www,1,com,90,['Tom Carter'],0.0,0.0,-0.2732,negative,Artists are concerned about the impact
Israelis develop AI-powered bot to fight antisemites online - Israel Hayom,https://news.google.com/rss/articles/CBMiY2h0dHBzOi8vd3d3LmlzcmFlbGhheW9tLmNvbS8yMDIzLzEwLzAxL2lzcmFlbGlzLWRldmVsb3AtYWktcG93ZXJlZC1ib3QtdG8tZmlnaHQtYW50aXNlbWl0ZXMtb25saW5lL9IBAA?oc=5,2023-10-01,Israel Hayom,US,en,israelis develop aipowered bot to fight antisemites online  israel hayom,64,11,Sunday,10,2023,4,True,False,Other,https://www.israelhayom.com/2023/10/01/israelis-develop-ai-powered-bot-to-fight-antisemites-online/,www.israelhayom.com,www,5,com,99,[],0.0,0.0,-0.3818,negative,summarize: 
"Michael Chabon, David Henry Hwang, Other Writers Sue Meta AI Platform LLaMA For Copyright Infringement, Seek Class Action Status - Deadline",https://news.google.com/rss/articles/CBMibWh0dHBzOi8vZGVhZGxpbmUuY29tLzIwMjMvMDkvbWljaGFlbC1jaGFib24tZGF2aWQtaGVucnktaHdhbmctd3JpdGVycy1zdWUtbWV0YS1haS1sbGFtYS1jb3B5cmlnaHQtMTIzNTU0NDg0Mi_SAXFodHRwczovL2RlYWRsaW5lLmNvbS8yMDIzLzA5L21pY2hhZWwtY2hhYm9uLWRhdmlkLWhlbnJ5LWh3YW5nLXdyaXRlcnMtc3VlLW1ldGEtYWktbGxhbWEtY29weXJpZ2h0LTEyMzU1NDQ4NDIvYW1wLw?oc=5,2023-09-12,Deadline,US,en,michael chabon david henry hwang other writers sue meta ai platform llama for copyright infringement seek class action status  deadline,119,21,Tuesday,9,2023,3,False,False,Other,https://deadline.com/2023/09/michael-chabon-david-henry-hwang-writers-sue-meta-ai-llama-copyright-1235544842/,deadline.com,deadline,4,com,109,['Jill Goldsmith'],-0.0124999999999999,0.2375,-0.4767,negative,"Chabon, Hwang,"
There’s never been a more important time in AI policy - MIT Technology Review,https://news.google.com/rss/articles/CBMiamh0dHBzOi8vd3d3LnRlY2hub2xvZ3lyZXZpZXcuY29tLzIwMjMvMDkvMTIvMTA3OTMxNS90aGVyZXMtbmV2ZXItYmVlbi1hLW1vcmUtaW1wb3J0YW50LXRpbWUtZm9yLWFpLXBvbGljeS_SAW5odHRwczovL3d3dy50ZWNobm9sb2d5cmV2aWV3LmNvbS8yMDIzLzA5LzEyLzEwNzkzMTUvdGhlcmVzLW5ldmVyLWJlZW4tYS1tb3JlLWltcG9ydGFudC10aW1lLWZvci1haS1wb2xpY3kvYW1wLw?oc=5,2023-09-12,MIT Technology Review,US,en,theres never been a more important time in ai policy  mit technology review,64,14,Tuesday,9,2023,3,False,False,Academic Journal,https://www.technologyreview.com/2023/09/12/1079315/theres-never-been-a-more-important-time-for-ai-policy/,www.technologyreview.com,www,6,com,106,['Melissa Heikkilä'],0.45,0.75,-0.2044,negative,Lawmakers are back from summer vacation
Threats like AI-aided bioweapons confound policymakers - Roll Call,https://news.google.com/rss/articles/CBMiV2h0dHBzOi8vcm9sbGNhbGwuY29tLzIwMjMvMDkvMTIvdGhyZWF0cy1saWtlLWFpLWFpZGVkLWJpb3dlYXBvbnMtY29uZm91bmQtcG9saWN5bWFrZXJzL9IBAA?oc=5,2023-09-12,Roll Call,US,en,threats like aiaided bioweapons confound policymakers  roll call,58,9,Tuesday,9,2023,3,False,False,Other,https://rollcall.com/2023/09/12/threats-like-ai-aided-bioweapons-confound-policymakers/,rollcall.com,rollcall,5,com,87,['Posted September'],0.0,0.0,-0.0772,negative,"In June, a group of students"
Alibaba CEO has 'AI warning' for employees - Times of India,https://news.google.com/rss/articles/CBMic2h0dHBzOi8vdGltZXNvZmluZGlhLmluZGlhdGltZXMuY29tL2dhZGdldHMtbmV3cy9hbGliYWJhLWNlby1oYXMtYWktd2FybmluZy1mb3ItZW1wbG95ZWVzL2FydGljbGVzaG93LzEwMzYxMjg4MS5jbXPSAXdodHRwczovL3RpbWVzb2ZpbmRpYS5pbmRpYXRpbWVzLmNvbS9nYWRnZXRzLW5ld3MvYWxpYmFiYS1jZW8taGFzLWFpLXdhcm5pbmctZm9yLWVtcGxveWVlcy9hbXBfYXJ0aWNsZXNob3cvMTAzNjEyODgxLmNtcw?oc=5,2023-09-12,Times of India,US,en,alibaba ceo has ai warning for employees  times of india,49,11,Tuesday,9,2023,3,False,False,News Outlet,https://timesofindia.indiatimes.com/gadgets-news/alibaba-ceo-has-ai-warning-for-employees/articleshow/103612881.cms,timesofindia.indiatimes.com,timesofindia,4,com,115,['Timesofindia.Com'],0.0,0.0,-0.34,negative,5G smartphones with 10GB or
